{
  "schema_version": "tcm.control.v0.6",
  "system_id": "robot-cell-7",
  "controls": [
    {
      "id": "camera_a",
      "direction": "negative",
      "weight": 0.3,
      "capacity": 1.0,
      "mode": "adaptive",
      "min_weight": 0.1,
      "max_weight": 0.8
    },
    {
      "id": "lidar",
      "direction": "negative",
      "weight": 0.3,
      "capacity": 1.0,
      "mode": "adaptive",
      "min_weight": 0.1,
      "max_weight": 0.8
    },
    {
      "id": "speed_scope",
      "direction": "positive",
      "weight": 0.3,
      "capacity": 1.0,
      "mode": "adaptive",
      "min_weight": 0.1,
      "max_weight": 0.8
    },
    {
      "id": "zone_scope",
      "direction": "positive",
      "weight": 0.3,
      "capacity": 1.0,
      "mode": "adaptive",
      "min_weight": 0.1,
      "max_weight": 0.8
    }
  ],
  "inspection": {
    "max_depth": 2
  }
}